분류번호,사무명,사무개요,신청유형,단순/복합,수수료,수수료내역,보관기간,등록일자,적용일자,폐지일자,소관부처,담당부서
1520000-0195,항만공사준공보고,비관리청이 항만공사를 완료한 때에 지체없이 공사준공보고서를 관리청에 제출하고 준공확인을 받기 위해 신청하는 민원사무입니다.,보고,단순민원,수수료 없음,수수료 없음,5년,2013.04.04,2013.04.05,,해양수산부,항만투자협력과
1520000-0194,항만시설유지(보수)공사 시행허가,"관리청이 아닌 자(이하 ""비관리청""이라 한다)가 항만공사를 시행하고자 하는 때에 대통령령이 정하는 바에 의하여 항만공사의 계획을 작성하여 관리청의 허가를 받기 위해 신청하는 민원사무입니다.",허가,단순민원,단일 수수료,"5,000원",5년,2013.04.04,2013.04.05,,해양수산부,항만투자협력과
1520000-0193,항만공사시행허가,"관리청이 아닌 자(이하 ""비관리청""이라 한다)가 항만공사를 시행하고자 하는 때에 대통령령이 정하는 바에 의하여 항만공사의 계획을 작성하여 관리청의 허가를 받기 위해 신청하는 민원사무입니다.",허가,복합민원,단일 수수료,"5,000원",5년,2013.04.04,2013.04.05,,해양수산부,항만투자협력과
1520000-0192,항만시설사용허가,항만시설(항로표지는 제외)을 사용하고자 하는 자는 관리청의 허가를 받거나 국토해양부장관으로부터 항만시설의 운영을 위임 ·위탁받은 자 와 임대계약을 체결하거나 당해 임대계약을 체결한 자의 승낙을 받기 위하여 신청하는 민원사무입니다.,허가,단순민원,수수료 없음,수수료 없음,5년,2013.04.04,2013.04.05,,해양수산부,항만운영과
1520000-0191,항만시설사용신고,국토해양부장관이 정하는 항만시설(항로표지는 제외)을 사용하려는 자가 신고하는 민원사무입니다.,신고,단순민원,수수료 없음,수수료 없음,5년,2013.04.04,2013.04.05,,해양수산부,항만운영과
1520000-0190,권리·의무이전인가,허가 또는 승인으로 인하여 발생한 권리·의무를 이전하고자 하는 자가 국토해양부령이 정하는 바에 따라 관리청의 인가를 받기 위해 신청하는 민원사무입니다.,인가,단순민원,수수료 없음,수수료 없음,5년,2013.04.04,2013.04.05,,해양수산부,항만투자협력과
1520000-0186,어선원부열람 및 등본발급,어선법시행규칙에 의한 어선원부열람 및 등본교부를 신청하는 민원사무입니다.,교부,단순민원,조례별 수수료,조례로 결정,3년,2016.06.10,2016.06.11,,해양수산부,어선정책팀
1520000-0185,선박국적증서 영역서 발급,어선법시행규칙에 의한 어선의 국제항해등로 선박국적증서의 영역서가 필요한 경우 선적항을 관할하는 시장·군수 또는 구청장으로부터 교부 받을 수 있도록 신청하는 민원사무입니다.,교부,단순민원,수수료 없음,수수료 없음,3년,2016.06.13,2016.06.14,,해양수산부,어선정책팀
1520000-0184,어선등록사항 변경등록,"어선의 등록사항 중 주소, 소유자, 톤수 등 등록사항 변경발생으로 인하여 변경등록사항을 30일이내에 신청하기 위한 민원사무입니다.",등록,단순민원,기타,어선법 제39조제1항에 따라 어선등록사항변경등록 수수료는 각 지자체의 조례에 의함,3년,2016.06.13,2016.06.14,,해양수산부,어선정책팀
1520000-0183,어선등록,"어선법에 의한 어선을 등록하고자 할 때 시,군,구에 신청하는 민원사무입니다.",등록,단순민원,기타,어선법 제39조제1항에 따라 어선등록 수수료는 각 지자체의 조례에 의함,3년,2013.04.03,2013.04.04,,해양수산부,어업정책과
1520000-0181,국제톤수증서(확인서)교부,어선의 국제항행시 필요한 국제톤수증서 또는 국제톤수확인서를 교부받고자 하는 자가 농림수산식품부장관 또는 영사에게 신청하는 민원사무입니다.,증명,단순민원,수수료 없음,수수료 없음,5년,2016.06.15,2016.06.16,,해양수산부,어선정책팀
1520000-0180,"어선총톤수(측정, 개측) 신청서","어선의 등기, 등록의 기준인 어선의 크기를 나타내는 총톤수의 측정 및 개측을 신청하는 민원사무입니다.",증명,단순민원,사례별 수수료,"10,000원~387,000원",5년,2016.06.15,2016.06.16,,해양수산부,어선정책팀
1520000-0179,어선관련 증서 재발급,"어선건조·개조허가서, 허가사항변경허가서, 어선총톤수측정증명서, 총톤수계산서, 국제톤수증서, 국제톤수확인서, 재화중량톤수증서, 선박국적증서, 선적증서, 등록필증가선박국적증서, 선박국적증서영역서, 가선박국적증서영역서 등의 증서를 재교부 받고자 할 때 신청하는 민원사무입니다.",교부,단순민원,사례별 수수료,-선박국적증서.선적증서 또는 등록필증의 재교부 : 500원 - 기타증서 재교부 수수료 없음,3년,2016.06.15,2016.06.16,,해양수산부,어선정책팀
1520000-0175,어선등록말소,"어선의 침몰, 멸실, 노후, 해체, 수출 등으로 인하여 어선으로 사용할 수 없을 때 등록의 말소를 신청하는 민원사무입니다.",등록,단순민원,수수료 없음,수수료 없음,3년,2016.06.15,2016.06.16,,해양수산부,어선정책팀
1520000-0173,"어선(건조, 건조발주, 개조, 개조발주)허가사항 변경허가신청",어선법의 규정에 의거 어선건조 및 개조허가를 받은 자가 허가 내용을 변경하고자 할 때 신청하는 민원사무입니다.,허가,단순민원,사례별 수수료,"-원양어업,해상화물운송사업수산물운반선:1,000~2,000원 -근해어업어선:800~1,600원 -연안어업어선:500~1,000원",3년,2016.06.15,2016.06.16,,해양수산부,어선정책팀
1520000-0172,"어선(개조, 개조발주)허가","어선의 주요치수 변경, 기관마력 변경 및 어선의 용도를 변경하거나 어업의 종류를 변경할 목적으로 어선의 구조나 설비를 변경하기 위해 기존 어선을 개조할 경우 허가를 신청하기 위한 민원사무입니다.",허가,단순민원,조례별 수수료,"-원양어업, 해상화물운송사업수산물운반선 : 1,000원 -근해어업어선 : 800원 -연안어업어선 : 500원",3년,2016.06.15,2016.06.16,,해양수산부,어선정책팀
1520000-0171,"어선(건조, 건조발주)허가",어선을 건조할 경우 건조허가를 신청하기 위한 민원사무입니다.,허가,단순민원,사례별 수수료,"-원양어업,해상화물운송사업수산물운반선:2,000원 -근해어업어선:1,600원 -연안어업,내수면어업어선 : 1,000원",3년,2016.06.15,2016.06.16,,해양수산부,어선정책팀
1520000-0169,화물적재고박지침서 재교부,선박소유자가 승인을 얻은 화물고박지침서가 멸실 또는 훼손되어 이를 재교부받고자 하는 때에 승인한 관련기관에 재교부를 신청하는 민원사무입니다.,교부,단순민원,기타,대행검사기관이 정하는 수수료 기준에 따름,5년,2013.04.04,2013.04.05,,해양수산부,해사산업기술과
1520000-0168,화물적재고박지침서 승인,화물적재고박지침서의 승인을 얻고자 하는 자가 승인 신청을 하는 민원사무입니다.,승인,단순민원,기타,대행검사기관이 정하는 수수료 기준에 따름,5년,2013.04.04,2013.04.05,,해양수산부,해사산업기술과
1520000-0167,위험물운송적합증 교부(재교부),위험물(병독을 옮기기 쉬운 물질 및 유해성물질을 제외한다)을 적재하는 화물구역을 갖는 길이 12미터이상의 선박은 위험물 및 화물구역의 종류별로 방화·화재탐지 및 소화장치등을 구비한 선박의 소유자가 위험물운송적합증 교부를 신청하는 민원사무입니다.(선박의 소유자는 위험물운송적합증의 기재내용중 변경사항이 있는 때에 신청하는 민원사무입니다.),교부,단순민원,기타,대행검사기관이 정하는 수수료 기준에 따름,5년,2013.04.04,2013.04.05,,해양수산부,해사산업기술과
1520000-0166,위험물용기검사,위험물을 운송하는 용기 및 포장의 안전성에 대하여 검사를 받기 위해 신청하는 민원사무입니다.,검사,단순민원,기타,"검정 10원~315,000원, 설계 : 64,100원~1,470,000원",5년,2013.04.04,2013.04.05,,해양수산부,해사산업기술과
1520000-0164,선박 및 선박용 물건의 검정,형식승인을 얻은 자가 당해 선박 또는 선박용물건을 제조·수입하여 형식승인 받은 대로 제조되었는 지를 검정받기 위하여 신청하는 민원사무입니다.,검정,단순민원,기타,대행검사기관이 정하는 수수료 기준에 따름,5년,2013.04.04,2013.04.05,,해양수산부,해사산업기술과
1520000-0161,선박 및 선박용 물건의 형식승인,선박 또는 선박용 물건에 대하여 형식승인을 얻고자 하는 자가 형식승인시험합격증명서를 첨부하여 국토해양부장관에게 신청하는 민원사무입니다.,승인,단순민원,기타,대행검사기관이 정하는 수수료 기준에 따름,5년,2013.04.04,2013.04.05,,해양수산부,해사산업기술과
1520000-0159,컨테이너검정,컨테이너 형식 승인을 받아 컨테이너를 제조한 때에 컨테이너 검정기준에 따른 검정을 받기 위하여 국토해양부장관에게 신청하는 민원사무입니다.,검정,단순민원,사례별 수수료,"-2,000원,-3,000원(지정검정기관에 신청시 지정검정기관의 수수료기준에 의함)",5년,2013.04.04,2013.04.05,,해양수산부,해사산업기술과
1520000-0156,컨테이너형식승인,컨테이너를 제조하고자 하는 자가 컨테이너에 대한 형식승인을 얻기 위하여 국토해양부장관에게 신청하는 민원입니다.,승인,단순민원,단일 수수료,"3,000원",영구,2013.04.04,2013.04.05,,해양수산부,해사산업기술과
1520000-0152,선박구조 등 변경허가,변경허가를 받고자 하는 선박소유자가 첨부하여 지방해양항만청장에게 신고하는 민원사무입니다.,허가,단순민원,수수료 없음,수수료 없음,10년,2013.04.04,2013.04.05,,해양수산부,해사산업기술과
1520000-0150,국제협약검사신청,국제협약검사를 받고자 신청하는 민원사무입니다.,검사,단순민원,기타,대행검사기관이 정하는 수수료 기준에 따름,10년,2013.04.04,2013.04.05,,해양수산부,해사산업기술과
1520000-0148,선박검사증서 등 유효기간연장,선박의 검사유효기간이 만료된 선박의 소유자가 선박검사를 받을 수 없는 장소에 있는 경우에 선박검사증서 및 국제협약증서 유효기간을 연장 받고자 대행검사기관에 신청하는 민원사무입니다.,검사,단순민원,기타,대행검사기관이 정하는 수수료 기준에 따름,3년,2013.04.04,2013.04.05,,해양수산부,해사산업기술과
1520000-0147,선박용물건 예비검사,선박용물건 중 예비검사 대상 물건을 제조·개조·수리·정비·수입하고자 하는 자가 그 선박용 물건을 설치하여야 할 선박이 특정되기 전에 대행검사기관의 검사를 받기 위하여 신청하는 민원사무입니다.,검사,단순민원,기타,대행검사기관이 정하는 수수료 기준에 따름,10년,2013.04.04,2013.04.05,,해양수산부,해사산업기술과
1520000-0146,선박제조검사,"여객선, 길이 24미터이상의 선박 기타 국토해양부령이 정하는 특수재질로 선박을 제조하는 자가 선박의 제조에 착수한 때부터 제조검사을 받기 위해 신청하는 민원사무입니다.",검사,단순민원,요율별 수수료,국토해양부장관이 고시한 금액,10년,2013.09.16,2013.09.16,,해양수산부,해사산업기술과
1520000-0145,선박검사신청,선박소유자가 선박의 시설에 관하여 정기·중간·임시·임시항행·특별·강화·예인선항해검사를 받기 위하여 대행검사기관에 신청하는 민원사무입니다.,검사,단순민원,기타,대행검사기관이 정하는 수수료 기준에 따름,10년,2013.04.04,2013.04.05,,해양수산부,해사산업기술과
1520000-0144,팽창식구명설비 정비업시설 등 확인,"팽창식구명설비의 수리 또는 정비를 수행하기에 적합한 설비, 시설 및 인력 등을 갖추었는지를 확인 받기 위하여 지방해양항만청장에게 신청하는 민원사무입니다.",확인,단순민원,수수료 없음,수수료 없음,10년,2013.04.04,2013.04.05,,해양수산부,해사산업기술과
1520000-0142,선박 또는 선박용 물건의 제조(정비) 확인,"선박 또는 선박용물건 우수사업장으로 지정받은 자가 우수사업장에서 제조 또는 정비되는 선박, 선박용 물건이 제조·정비 규정에 적합하게 제조·정비되었음을 확인받기 위하여 대행검사기관에게 신청하는 민원사무입니다.",확인,단순민원,기타,대행검사기관이 정하는 수수료 기준에 따름,10년,2013.04.04,2013.04.05,,해양수산부,해사산업기술과
1520000-0139,우수 제조(정비)사업장 (변경)지정,"우수제조사업장 또는 우수정비사업장의 지정기준에 적합하도록 관련서류, 장비 및 시설 등을 갖추고 국토해양부장관에게 지정을 신청하는 민원사무입니다.",지정,단순민원,사례별 수수료,"인정 100,000원, 변경인정 30,000원",영구,2013.04.04,2013.04.05,,해양수산부,해사산업기술과
1520000-0138,해양오염방지설비 성능시험ㆍ검정 및 인정업무 대행자지정,해양오염방지설비의 성능시험ㆍ검정 및 인정업무를 대행하고자 하는 자가 국토해양부장관에게 신청하는 민원사무입니다.,지정,단순민원,수수료 없음,수수료 없음,5년,2013.04.04,2013.04.05,,해양수산부,해사산업기술과
1520000-0137,유해액체물질배출지침서 검인,유해액체물질을 산적하여 운반하는 선박으로서 국토해양부령이 정하는 선박에 국토해양부령이 정하는 설치기준에 의하여 유해액체물질의 선박안의 저장 또는 처리를 위한 설비 기타 유해액체물질에 의한 해양오염을 방지하기 위한 설비를 설치한 선박소유자가 국토해양부령이 정하는 기준에 의하여 유해액체물질 배출방법 및 설비에 관한 지침서를 작성하여 검인을 받기 위해 신청하는 민원사무입니다.,인증,단순민원,기타,대행검사기관이 정하는 수수료 기준에 따름,3년,2013.04.04,2013.04.05,,해양수산부,해사산업기술과
1520000-0136,해양오염방지설비검정,해양오염방지설비의 형식승인을 얻은 자가 해양오염방지설비를 제작ㆍ제조하거나 수입한 때에 당해설비의 검정을 받고자 할 때 신청하는 민원사무입니다.,검정,단순민원,기타,대행검사기관이 정하는 수수료 기준에 따름,5년,2013.04.04,2013.04.05,,해양수산부,해사산업기술과
1520000-0135,해양오염방지설비 등의 성능시험,해양오염방지설비 및 자재·약제를 제작·제조·수입하고자 하는 자가 국토해양부장관 또는 해양경찰청장으로부터 형식승인을 받기 위하여 사전에 성능시험을 대행검사기관에 신청하는 민원입니다.,시험,단순민원,기타,대행검사기관이 정하는 수수료 기준에 따름,10년,2013.04.04,2013.04.05,,해양수산부,해사산업기술과
1520000-0133,해양오염방지검사증서 등 유효기간연장,해양오염방지증서 등을 교부받은 자가 해양오염방지증서 등의 유효기간이 만료된 때에 유효기간을 연장하기 위하여 신청하는 민원사무입니다.,허가,단순민원,수수료 없음,수수료 없음,5년,2013.04.04,2013.04.05,,해양수산부,해사산업기술과
1520000-0132,해양오염방지설비 임시항해검사신청,기름오염방지설비·유해액체물질오염방지설비 또는 폐기물오염방지설비를 설치하여야 할 선박과 화물창을 설치하여야 할 선박에 대하여 해양오염방지증서를 교부받기 전에 임시로 선박을 항행에 사용하고자 할 때 신청하는 민원사무입니다.,검사,단순민원,기타,대행검사기관이 정하는 수수료 기준에 따름,5년,2013.04.04,2013.04.05,,해양수산부,해사산업기술과
1520000-0131,해양오염방지설비 형식승인,해양오염방지설비를 제작·제조하거나 수입하고자 하는 자가 국토해양부령이 정하는 바에 따라 국토해양부장관의 형식승인을 얻기 위해 신청하는 민원사무입니다.,승인,단순민원,기타,대행검사기관이 정하는 수수료 기준에 따름,5년,2013.04.04,2013.04.05,,해양수산부,해사산업기술과
1520000-0130,위험물컨테이너 수납검사,"하송인 또는 선박소유자가 국토해양부장관이 정하는 위험물을 컨테이너에 수납하여 운송하고자 하는 경우에 컨테이너 수납방법, 당해 위험물에 적합한 용기·포장의 사용여부와 표시 및 표찰의 적합여부에 관하여 관할지방해양항만청(검사대행: 한국해사위험물검사소)의 검사를 받기 위해 선박안전법 제16조의2에 의거 신청하는 민원사무입니다.",검사,단순민원,기타,"- 20피트컨테이너수수료 : 76,000원, - 40피트컨테이너수수료 : 91,000원",5년,2013.04.04,2013.04.05,,해양수산부,해사산업기술과
1520000-0129,위험물적재검사,선박에 의하여 위험물 또는 특수화물을 적재·운송하거나 저장하는 자가 항행상의 위험방지 및 인명의 안전에 적합한 방법에 따라 적재·운송 또는 저장하기 위해 그 방법의 적합여부에 관하여 검사를 받거나 승인을 위해 선박안전법 제16조의2에 의거 신청하는 민원사무입니다.,검사,단순민원,단일 수수료,"80,000원",5년,2013.04.04,2013.04.05,,해양수산부,해사산업기술과
1520000-0128,현존선 곡류적재도 승인,현존선에 곡류를 적재하여 운송하고자 하는 자가 선박에 곡류를 산산적운송하는 경우에 곡류적재자료에 관하여 승인을 얻기 위해 신청하는 민원사무입니다.,승인,단순민원,단일 수수료,"1,000원",5년,2013.04.04,2013.04.05,,해양수산부,해사산업기술과
1520000-0127,선박 곡류적재도승인,곡류적재도에 기재된 적재방법에 따라 곡류를 산적운송하고자 하는 자가 신청하는 민원사무입니다.,승인,단순민원,단일 수수료,"1,000원",5년,2013.04.04,2013.04.05,,해양수산부,해사산업기술과
1520000-0126,선박 곡류적재자료승인,선박에 곡류를 산적운송하는 경우에 곡류적재자료에 관하여 승인을 얻기 위해 신청하는 민원사무입니다.,승인,단순민원,단일 수수료,"1,000원",5년,2013.04.04,2013.04.05,,해양수산부,해사산업기술과
1520000-0125,함수액상화물질 운반선 인정서재교부,선박소유자가 함수액상화물질운반선 인정서가 멸실 또는 훼손된 때에 지방해양항만청에 재교부를 신청하는 민원사무입니다.,교부,단순민원,단일 수수료,500원,5년,2013.04.04,2013.04.05,,해양수산부,해사산업기술과
1520000-0124,함수액상화물질 운반선인정,선박소유자는 함수액상화물질을 산적하여 운송하는 강선으로서 인정을 받고자 하는 때에 선박의 소재지를 관할하는 지방해양항만청에 신청하는 민원사무입니다.,인정,단순민원,단일 수수료,"6,000원",5년,2013.04.04,2013.04.05,,해양수산부,해사산업기술과
1520000-0122,액상화물질 수분측정,"선장은 당해액상화물질의 소재지를 관할하는 해양항만관청 또는 검량·감정을 업으로 하는 법인중 액상화물질의 운송허용수분치 및 수분의 측정을 행하는 자로서 국토해양부장관의 지정을 받은 자(이하 ""지정측정기관""이라 한다)가 운송허용수분치 및 수분의 측정을 행한 액상화물질외의 액상화물질을 선박에 산적운송하여서는 아니된다. 다만, 적재량을 넘지 아니하는 양을 적재할 경우 또는 운송허용수분치 및 수분의 측정을 받은 액상화물질을 다른 선박으로부터 옮겨 싣는 경우에는 그러하지 아니하다란 규정에 의한 측정을 받고자 하는 자가 지방해양항만청 또는 지정측정기관에 신청하는 민원사무입니다.",기타,단순민원,사례별 수수료,"-300톤이하 : 2,000원 -300톤초과: 2,000원(매20톤 초과마다 200원을 더한금액)",5년,2013.04.04,2013.04.05,,해양수산부,해사산업기술과
1520000-0120,유류오염손해배상 보장계약증명서교부(재교부),"선박소유자가 선박(책임협약체약국인 외국의 국적을 가진 선박을 제외한다)에 대하여 보장계약이 체결되어 있음을 증명하는 서면(이하 ""보장계약증명서""라 한다)을 교부받기 위해 신청하는 민원사무입니다.",교부,단순민원,단일 수수료,"2,000원",5년,2013.04.04,2013.04.05,,해양수산부,해사안전정책과
1520000-0119,보장계약증명서 기재사항 변경신고,보장계약증명서를 교부받은 자가 그 보장계약증명서의 기재사항에 변경이 있는 때에 그 변경이 있는 날부터 15일이내에 그 변경사항을 국토해양부장관에게 신고하는 민원사무입니다.,교부,단순민원,단일 수수료,"2,000원",5년,2013.04.04,2013.04.05,,해양수산부,해사안전정책과
1520000-0118,해양오염방지설비검사,"기름오염방지설비ㆍ유해액체물질오염방지설비 또는 폐기물오염방지설비(이하 ""해양오염방지설비""라 한다)를 설치하여야 할 선박과 적합한 화물창을 설치하여야 할 선박(이하 ""검사대상선박""이라 한다)소유자가 당해 해양오염방지설비 또는 화물창(이하 ""해양오염방지설비등""이라 한다)에 대하여 국토해양부령이 정하는 바에 따라 행하는 정기검사, 중간검사, 임시검사,임시항행검사를 신청하는 민원사무입니다.",검사,단순민원,기타,대행검사기관이 정하는 수수료 기준에 따름,10년,2013.04.04,2013.04.05,,해양수산부,해사산업기술과
1520000-0112,재화중량톤수측정,재화중량톤수의측정 또는 개측을 받고자 할 경우 관할 지방해양항만청장이나 당해 선박의 소재지를 관할하는 영사에게 신청하는 민원사무입니다.,교부,단순민원,기타,"증서 : 2,000원, 전부개측 : 8,000~80,000원, 일부개측 : 2,000원",5년,2013.04.04,2013.04.05,,해양수산부,해사안전정책과
1520000-0108,국제톤수증서(국제톤수확인서) 발급(변경발급) 신청,"한국선박 소유자가 선박을 국제항해에 종사시키고자 할 경우 길이 24미터 이상의 선박은 국제 톤수증서를, 길이 24미터 미만의 선박은 국제톤수확인서를 교부 받고자 할 경우에 신청하거나, 선박의 구조변경 등으로 국제톤수가 변경되었을 때 선박의 국제톤수증서 또는 국제톤수확인서의 변경교부를 받고자 할 경우에 신청하는 민원사무입니다.",교부,단순민원,사례별 수수료,"증서(발급, 변경발급) 2,000원, 발급 수수료[측정(전부)개측] 1,500원~80,000원, 일부개측 2000원~5,000원",5년,2013.04.04,2013.04.05,,해양수산부,해사안전정책과
1520000-0107,선박원부 등·초본발급(열람),선박등록사항을 기재한 선박원부의 등본·초본을 교부 받거나 선박원부의 열람을 하고자 하는 자가 지방해양항만청장에게 신청하는 민원사무입니다.,교부,단순민원,사례별 수수료,"방문, 우편 발급시 100원, 전자민원(인터넷) 발급시 무료",5년,2013.04.04,2013.04.05,,해양수산부,해사안전정책과
1520000-0106,선박국적증서(가선박국적증서) 영역서교부,선박국적증서 또는 가선박국적증서의 영역서를 교부받고자 하는 경우 관할 지방해양항만청장 또는 영사에게 신청하는 민원사무입니다.,교부,단순민원,단일 수수료,"1,000원",5년,2013.04.04,2013.04.05,,해양수산부,해사안전정책과
1520000-0099,선박말소등록,"선박이 멸실·침몰 또는 해체된 때, 대한민국국적을 상실한 때 등의 경우에 지방해양항만청장에게 말소등록의 신청을 하는 민원사무입니다.",등록,단순민원,단일 수수료,200원,5년,2013.04.04,2013.04.05,,해양수산부,해사안전정책과
1520000-0097,선박원부변경등록,선박등록 사항에 변경이 있는 경우 선박소유자가 그 사실을 안 날로부터 2주일이내에 변경등록 신청을 하는 민원사무입니다.,등록,단순민원,기타,"500 ~ 1,500원",5년,2013.04.04,2013.04.05,,해양수산부,해사안전정책과
1520000-0095,선박등록,한국선박의 소유자가 선박의 등기를 한 후 선적항을 관할하는 지방해양항만청장에게 등록을 신청하는 민원사무입니다.,등록,단순민원,단일 수수료,"신청 1,500원, 증서발급 500원",5년,2013.04.04,2013.04.05,,해양수산부,해사안전정책과
