분류번호,사무명,사무개요,신청유형,단순/복합,수수료,수수료내역,보관기간,등록일자,적용일자,폐지일자,소관부처,담당부서
SG4CADM-2015,토지임야대장등본교부 다량신청,토지임야대장등본교부 민원에 대하여 여러 번지를 한번에 신청할 수 있는 민원입니다.,교부,단순민원,,,,2005.05.09,2005.05.09,,공통,공통
9740000-0009,공탁신청(공탁물지급청구 포함),"공탁자가 법령의 규정된 원인에 따라 금전, 유가증권, 그 밖의 물품을 공탁소에 맡기고, 일정한 자가 공탁금을 수령하도록 함으로써 채무변제, 재판상 담보, 강제집행을 면하거나 손해를 피하기 위하여 또는 절차의 완결을 짓기 위한 제도입니다.",승인,단순민원,수수료 없음,수수료 없음,5년,2016.03.14,2016.03.15,,대법원,사법등기국
9740000-0008,친양자입양취소신고,가정법원의 허가를 얻어 친양자 입양을 취소하기 위해 신청하는 민원입니다.,건의,단순민원,수수료 없음,수수료 없음,27년,2016.03.11,2016.03.16,,대법원,가족관계등록과
9740000-0007,친양자파양신고,가정법원의 허가를 얻어 친양자입양을 파양하고자 하는 사람이 재판의 확정일부터 1개월 이내에 가족관계등록 관서의 장에게 신고하는 민원입니다.,건의,단순민원,수수료 없음,수수료 없음,27년,2016.03.15,2016.03.16,,대법원,가족관계등록과
9740000-0006,성·본계속사용신고,부가 혼인외 자를 인지할 때 인지 전의 자녀의 성과 본을 유지할 경우 그 취지를 가족관계등록 관서의 장에게 신고하는 민원입니다.,신고,단순민원,수수료 없음,수수료 없음,27년,2016.04.29,2016.04.29,,대법원,가족관계등록과
9740000-0005,성·본변경신고,자의 복리를 위하여 가정법원의 허가를 얻어 자녀의 성.본을 변경하고자 하는 자가 재판확정일부터 1개월 이내에 가족관계등록 관서의 장에게 신고하는 민원입니다.,건의,단순민원,수수료 없음,수수료 없음,27년,2016.03.15,2016.03.16,,대법원,가족관계등록과
9740000-0004,가족관계등록부 등의 증명서 교부 신청,"국민의 출생.혼인.사망 등 가족관계의 발생 및 변동사항에 관한 증명서(가족관계증명서, 기본증명서, 혼인관계증명서, 입양관계증명서, 친양자입양관계증명서)를 발급 받고자 할 때 신청하는 민원사무입니다.",증명,단순민원,사례별 수수료,"증명서 1통당 1,000원 / 인터넷으로 발급받을 때는 무료임",2년,2016.03.15,2016.03.16,,대법원,가족관계등록과
9740000-0003,건물등기사항증명서,건물등기사항증명서,건의,단순민원,사례별 수수료,"방문신청 통당 1,200원/무인발급기 및 인터넷발급신청 통당 1,000원",없음,2016.03.15,2016.03.16,,대법원,부동산등기과
9740000-0002,토지등기사항증명서,부동산의 존부 및 그 권리관계를 확인하기 위한 사항입니다.,건의,단순민원,사례별 수수료,"방문신청 통당 1,200원/무인발급기 및 인터넷발급신청 통당 1,000원",없음,2016.03.15,2016.03.16,,대법원,부동산등기과
9740000-0001,법인등기사항증명서,법인등기사항증명서,교부,단순민원,사례별 수수료,"방문신청 통당 1,200원/무인발급기 및 인터넷발급신청 통당 1,000원",없음,2016.03.15,2016.03.16,,대법원,사법등기국
1750000-0004,소방기술과 관련된 자격·학력 및 경력의 인정 업무,"소방기술 인정 자격수첩과 경력수첩을 발급받기 위한 자격, 학력, 경력 인정 자격수첩 발급을 위한 첨부서류 확인업무",인정,단순민원,사례별 수수료,소방기술 인정 자격수첩 및 경력수첩 발급 수수료,10년,2016.04.05,2016.07.29,,국민안전처,소방산업과
1750000-0003,소방시설업 휴업.폐업 등의 신고,"소방시설업을 휴업, 폐업, 재개업 신고를 하려는 자가 제출하여야 하는 서류",신고,단순민원,수수료 없음,수수료 없음,10년,2016.04.23,2016.07.29,,국민안전처,소방산업과
1750000-0002,연안체험활동 계획 신고,"① 연안체험활동 운영자는 총리령으로 정하는 절차와 방법에 따라 특별자치도지사·시장·군수·구청장에게 연안체험활동 안전관리 계획서(이하 ""계획서""라 한다)를 작성하여 신고하는 민원입니다.",신고,단순민원,수수료 없음,수수료 없음,10년,2015.04.24,2015.04.30,,국민안전처,해상안전과
1750000-0001,(연안체험활동)안전교육 신청,"안전교육을 받으려는 사람은 별지 제1호서식의 안전교육 신청서를 국민안전처장관[법 제22조제2항 및 「연안사고 예방에 관한 법률 시행령」(이하 ""영""이라 한다) 제11조제2항에 따라 국민안전처장관으로부터 업무를 위탁받은 자를 포함한다]에게 제출하는 민원입니다.",제출,단순민원,수수료 없음,수수료 없음,10년,2015.04.24,2015.04.30,,국민안전처,해상안전과
1740000-0001,사망자 재산조회 통합처리 신청,"사망신고 처리 시 또는 그 이후에 상속의 권한 있는자가 시군구, 읍면동에 신청하는 사망자의 재산조회 및 지방세 체납액, 미납액, 국민연금 가입여부, 자동차 소유여부, 토지 소유내역의 조회 신청하는 사무입니다.",확인,단순민원,수수료 없음,수수료 없음,1년,2016.08.16,2016.08.17,,행정자치부,공공서비스혁신과
1710000-0011,정보통신공사업 합병에 관한 신고 접수,정보통신공사업 합병신고 시 접수되는 증빙서류 등을 확인,신고,단순민원,수수료 없음,수수료 없음,10년,2015.11.17,2015.11.30,,미래창조과학부,통신정책기획과
1710000-0010,정보통신공사업 양도에 관한 신고 접수,정보통신공사업 양도신고 시 제출해야하는 신청 서류를 확인,신고,단순민원,수수료 없음,수수료 없음,10년,2015.11.17,2015.11.30,,미래창조과학부,통신정책기획과
1710000-0009,정보통신공사업 등록 신청 접수,정보통신공사업 신규 등록 관련 등록기준에 적합한 지 여부와 관련 증빙서류 등을 확인,등록,단순민원,수수료 없음,수수료 없음,10년,2015.11.17,2015.11.30,,미래창조과학부,통신정책기획과
1710000-0008,연구실 안전점검 또는 정밀안전진단 대행기관의 변경등록,안전점검 및 정밀안전진단 대행기관은 등록한 사항을 변경하고자 할 경우 변경을 증명하는 서류와 함께 변경등록을 신청하여야 함,등록,단순민원,수수료 없음,수수료 없음,10년,2015.08.25,2015.09.30,,미래창조과학부,연구환경안전팀
1710000-0007,연구실 안전점검 또는 정밀안전진단 대행기관의 등록,연구실 안전점검 및 정밀안전진단을 대행하려는 자는 등록신청서에 기술인력 보유 현황 및 장비명세서를 첨부하여 제출,등록,단순민원,수수료 없음,수수료 없음,10년,2015.09.30,2015.10.01,,미래창조과학부,연구환경안전팀
1710000-0006,고출력·누설 전자파 안전성 평가 신청,고출력 전자파로 인한 피해와 누설 전자파에 의한 정보유출을 방지하기 위하여 구축된 방호차폐시설 또는 장비보호시설의 안전성 평가,기타,단순민원,사례별 수수료,신청 대상 시설의 측정지점 및 도전성 선로 개수에 따라 수수료 상이,10년,2014.12.05,2015.01.09,,미래창조과학부,전파환경안전과
1710000-0005,정보보호 최고책임자 지정 신고,정보통신망 이용촉진 및 정보보호 등에 관한 법률 제45조의3 및 같은법 시행령 제36조의 7에 따라 정보보호 최고책임자 지정신고서 제출,신고,단순민원,수수료 없음,수수료 없음,10년,2014.12.30,2015.01.09,,미래창조과학부,정보보호정책과
1710000-0003,방송통신기자재 등 시험기관 심사원 등록,"「방송통신기자재등 시험기관의 지정 및 관리에 관한 고시」 제6조에 따라 시험기관 심사업무(이하 ""심사""라 한다)에 참여하는 심사원의 등록 업무",등록,단순민원,수수료 없음,수수료 없음,10년,2014.08.05,2014.08.06,,미래창조과학부,정보통신적합성평가과
1710000-0002,외국인 고용추천,「출입국관리법 시행령」 제7조제3항에 따라 방송출연 등 취업을 위한 목적으로 사증발급허가를 받고자 하는 외국인에 대한 추천,추천,단순민원,수수료 없음,수수료 없음,10년,2015.11.27,2015.11.30,,미래창조과학부,방송산업정책과
1710000-0001,미래창조과학부 후원명칭 승인,기관 또는 단체가 주최하는 행사에 미래창조과학부의 명칭 또는 로고를 사용신청의 승인업무,승인,단순민원,수수료 없음,수수료 없음,10년,2013.11.25,2013.12.27,,미래창조과학부,운영지원과
1690000-0031,군용 총포 운반 허가,"군용총포,도검,화약류 등에 대하여 운반기간과 운반품목, 운반구간 등에 대하여 허가를 받기 위해 방위사업청자에게 신청하는 민원입니다.",허가,단순민원,수수료 없음,수수료 없음,3년,2015.07.03,2015.07.31,,방위사업청,방산지원과
1690000-0030,국내조달 납품실적 증명서 발급,해당물품 납품 실적을 증명하기 위한 발급사무입니다.,증명,단순민원,수수료 없음,수수료 없음,5년,2015.03.31,2015.07.07,,방위사업청,지출심사팀
1690000-0028,"국외소재상사(제조업체, 공급업체) 등록",방위사업청 국외조달 입찰 및 계약에 참가하기 위한 국외소재상사의 등록 신청에 대한 민원입니다.,등록,단순민원,수수료 없음,수수료 없음,3년,2014.04.03,2014.04.30,,방위사업청,고객지원센터
1690000-0026,국내·국외 조달원 등록증 발급,방위사업청에 등록된 국내·국외 조달원 등록증 발급 신청에 대한 민원입니다.,등록,단순민원,수수료 없음,수수료 없음,3년,2014.04.03,2014.04.04,,방위사업청,고객지원센터
1690000-0024,보증기관지정 신청,방산업체 재정부담 경감과 이용 편의 제고에 유용한 보증기관 지정을 받고자 하는 자가 관련규정에 의거 방위사업청장에게 신청하는 민원입니다.,지정,단순민원,수수료 없음,수수료 없음,3년,2009.09.23,2009.04.04,,방위사업청,방산정책과
1690000-0022,"국내소재상사(공급업체, 국외업체의 국내지사, 군수품 무역업체) 등록",방위사업청 국외조달 입찰/계약에 참가하기 위한 국내소재상사 등록 신청에 대한 민원입니다.,등록,단순민원,수수료 없음,수수료 없음,3년,2014.04.03,2014.04.30,,방위사업청,고객지원센터
1690000-0021,주요방산물자(국방과학기술) 국제입찰 참가승인,주요방산물자 및 국방과학기술의 수출을 위해 국제입찰을 참가하고자 하는 경우에는 방위사업청장(품목통제담당관)의 국제입찰승인을 얻어야 하는 민원입니다.,허가,단순민원,수수료 없음,수수료 없음,5년,2014.03.14,2014.04.04,,방위사업청,품목심사담당관
1690000-0020,계약전 생산 승인 및 품질 확인,"방위사업청장은 방산물자의 생산계획 물량을 매년 해당 방산업체에 통보하는데, 방산업체는 통보된 생산 계획물량중 당해연도 물량을 당해연도 조달계약 전에 생산하고자 하는 경우에 방위사업청장의 승인을 얻어야 민원입니다.",승인,단순민원,수수료 없음,수수료 없음,3년,2013.03.28,2013.03.29,,방위사업청,획득정책과
1690000-0019,국내업체 품목등록,"국내,외 경쟁입찰에 참여하고자 하는 자의 업체등록(품목등록/ 추가) 및 입찰참가자격 확인/계약을 위해 제출하는 민원입니다.",등록,단순민원,수수료 없음,수수료 없음,3년,2016.08.18,2016.08.19,,방위사업청,고객지원센터
1690000-0018,국유재산 사용허가 추천(방산업체·전문연구기관),방산업체 또는 연구기관이 행정재산등을 사용하거나 대부·양여 받고자 할 때에는 방위사업청장의 추천을 받아 당해 재산의 관리청에 신청하는 민원입니다.,추천,단순민원,수수료 없음,수수료 없음,3년,2009.09.23,2009.09.24,,방위사업청,방산정책과
1690000-0017,방산업체 재산처분승인,방산업체·연구기관이 보조금에 의하여 취득하거나 그 효용이 증가된 재산을 처분하고자 할 경우 그 승인을 얻기 위해 방위사업청장에게 신청하는 민원입니다.,승인,단순민원,수수료 없음,수수료 없음,3년,2010.11.16,2010.11.24,,방위사업청,방산정책과
1690000-0016,군용총포·도검·화약류 수입 허가,"군용으로 사용하는 총포, 도검 및 화약류 등의 수입허가를 받으려는 자가 방위사업청장에게 신청하는 민원입니다.",허가,단순민원,수수료 없음,수수료 없음,5년,2014.04.01,2014.04.02,,방위사업청,품목심사담당관
1690000-0015,방산물자지정,군용물자에 대하여 방산물자 지정을 받고자하는 자가 관련규정에 의거 방위사업청장에게 신청하는 민원입니다.,지정,단순민원,수수료 없음,수수료 없음,3년,2014.03.17,2014.04.30,,방위사업청,방산정책과
1690000-0014,전문연구기관위촉,"방산물자의 연구·개발·시험·측정, 방산물자의 시험 등을 위해 방위사업청의 위촉을 받고자 하는 기관이 제반서류를 방위사업청장에게 제출하는 민원입니다.",지정,단순민원,수수료 없음,수수료 없음,3년,2012.02.23,2012.02.24,,방위사업청,정책조정담당관
1690000-0013,방산물자의 생산·매매계약 체결승인,"군용총포, 도검, 화약류 등 방산물자의 생산, 매매계약 체결을 위해 승인을 받고자 방위사업청장에게 신청하는 민원입니다.",승인,단순민원,수수료 없음,수수료 없음,3년,2012.04.26,2013.04.30,,방위사업청,방산지원과
1690000-0012,군용총포·도검·화약류 제조업(제조품목변경)허가,"군용총포, 도검, 화약류 등을 제조하려는 자, 제조품목을 추가하려고 하는 자, 제조시설을 신축, 증축하려고 하는 자 또는 그 시설을 사용하려고 하는자가 그 제조에 대한 사항을 승인받고자 방위사업청장에게 신청하는 민원입니다.",허가,단순민원,수수료 없음,수수료 없음,3년,2013.03.28,2013.04.30,,방위사업청,방산지원과
1690000-0010,군용총포·도검·화약류 제조시설 등의 신축(변경)허가,군용총포·도검·화약류의 제조업 허가를 받은자 또는 군용총포등을 연구·개발하는 연구기관의 장이 그 관련시설을 신축 또는 변경할 경우 그에 대한 사항을 허가받고자 방위사업청장에게 신청하는 민원입니다.,허가,단순민원,수수료 없음,수수료 없음,3년,2013.03.28,2013.03.29,,방위사업청,방산지원과
1690000-0009,군용총포소지허가,군용총포 등을 소지하려는 자가 그 소지에 대한 사항을 허가 받기 위해 방위사업청장에게 신청하는 민원입니다.,허가,단순민원,수수료 없음,수수료 없음,3년,2013.03.28,2013.04.30,,방위사업청,방산지원과
1690000-0008,군용총포·도검·화약류 제조시설 등의 완성검사,제조시설등의 신축·변경을 완료한 제조업체 또는 연구기관의 장이 당해 제조시설의 신축·변경공사를 완료한 날부터 20일 이내에 완성검사를 받고자 방위사업청장에게 신청하는 민원입니다.,검사,단순민원,수수료 없음,수수료 없음,3년,2010.03.24,2010.03.25,,방위사업청,방산정책과
1690000-0007,군용화약류제조·관리보안책임자 선임(해임·갱신) 승인,군용화약류 제조·관리보안책임자 선임·해임·갱신 승인을 위하여 방위사업청장에게 신청하는 민원입니다.,승인,단순민원,수수료 없음,수수료 없음,3년,2013.03.28,2013.04.30,,방위사업청,방산지원과
1690000-0006,주요방산물자(국방과학기술) 수출허가,주요방산물자 및 국방과학기술을 국외로 수출하거나 그 거래를 중개하고자 하는자가 방위사업청장에게 신청하는 민원입니다.,허가,단순민원,수수료 없음,수수료 없음,3년,2014.04.02,2013.04.30,,방위사업청,품목심사담당관
1690000-0005,주요방산물자견본 수출허가,주요방산물자의 견본을 수출하고자 하는 자가 그 허가를 받기 위하여 방위사업청장에게 신청하는 민원입니다.,허가,단순민원,수수료 없음,수수료 없음,3년,2014.04.29,2014.04.30,,방위사업청,품목심사담당관
1690000-0004,주요방산물자(국방과학기술) 수출 예비승인,주요방산물자 및 국방과학기술의 수출허가를 받기 전에 수출상담을 하고자 하는 자가 주요방산물자수출예비승인을 받고자 방위사업청장에게 신청하는 민원입니다.,승인,단순민원,수수료 없음,수수료 없음,3년,2014.04.29,2014.04.30,,방위사업청,품목심사담당관
1690000-0003,주요방산물자(국방과학기술) 수출업 또는 중개업 신고,주요방산물자 및 국방과학기술을 국외로 수출하거나 그 거래를 중계(제3국간의 중개를 포함한다) 하는 것을 업으로 하는 자가 방위사업청장에게 신고하여야 하는 민원입니다.,지정,단순민원,수수료 없음,수수료 없음,5년,2014.04.29,2014.04.03,,방위사업청,품목심사담당관
1660000-0067,방재안전대책수립대행자의 변경등록신청,방재안전대책수립대행자 등록사항 변경사유가 발생한 때에는 소방방재청장에게 변경등록 신청을 하고 소방방재청장은 변경내용을 대행자등록증에 기재하고 공고하여야 한다.,건의,단순민원,수수료 없음,수수료 없음,10년,2014.11.24,2014.11.25,,국민안전처,기후변화대책과
1660000-0066,방재안전대책수립대행자의 등록신청,방재안전대책수립 업무를 수행하고자 하는 자는 소방방재청장에게 등록신청을 하고 소방방재청장은 등록요건에 적합한 경우 등록증을 교부하여야 한다.,제출,단순민원,수수료 없음,수수료 없음,10년,2014.11.24,2014.11.25,,국민안전처,기후변화대책과
1660000-0065,내진보강지원신청서,지진재해대책법 제16조의 2항에 따라 민간소유 건축물의 내진보강지원을 위한 내진보강지원신청을 위한 신청사무입니다.,기타,단순민원,수수료 없음,수수료 없음,10년,2014.11.24,2014.11.25,,국민안전처,지진방재과
1660000-0064,소방공사감리원 배치통보,소방공사감리업자가 감리원을 소방공사감리현장에 배치하는 경우에는 배치사항을 소방본부장 또는 소방서장에게 알려야 한다,제출,단순민원,수수료 없음,수수료 없음,5년,2014.11.24,2014.11.25,,국민안전처,소방산업과
1660000-0063,소방공사감리원 배치변경통보,소방공사감리업자가 감리원을 배치하는 경우 배치사항을 소방본부장 또는 소방서장에게 알려야 한다,제출,단순민원,수수료 없음,수수료 없음,5년,2014.11.24,2014.11.25,,국민안전처,소방산업과
1660000-0062,소방시설업 등록(변경)신고,"소방시설의 설계업, 공사업,감리업을 하고자 하는 사람이 소방시설업의 등록(변경)을 하기 위하여 신청하는 민원사무입니다.",등록,단순민원,사례별 수수료,"신규신고(전문 4만원, 일반 2만원), 변경신고(전문 2만원, 일반 1만원)",10년,2015.11.11,2016.07.29,,국민안전처,소방산업과
1660000-0060,의연금품 모집(변경)허가,자연재해로 인한 이재민구호를 위하여 의연금품을 모집하려는 자는 소방방재청장으로부터 의연금품 모집허가 또는 변경허가를 받아야 한다.,허가,단순민원,수수료 없음,수수료 없음,5년,2014.11.24,2014.11.25,,국민안전처,재난구호과
1660000-0059,소방시설업지위승계신고,소방시설업 등록시 필요한 서류,신고,단순민원,단일 수수료,20000,3년,2016.06.30,2016.07.29,,국민안전처,소방산업과
1660000-0058,안전시설등 설치(완공)신고,소방시설등설치 완공신고시 설계도서 및 평면도를 첨부하여 신고,신고,단순민원,수수료 없음,수수료 없음,3년,2014.11.24,2014.11.25,,국민안전처,소방제도과
1660000-0057,소방시설업등록증(등록수첩)재교부신청,훼손된 등록수첩 재교부,교부,단순민원,단일 수수료,10000,3년,2014.11.24,2014.11.25,,국민안전처,소방산업과
1660000-0055,화재증명 발급 신청,"화재로 인한 피해를 입었을 때 그 대상과 화재발생일시, 피해물건 등 화재관련 사실을 증명받기 위하여 신청하는 민원사무입니다.",증명,단순민원,조례별 수수료,조례로 정함.,3년,2013.03.13,2014.11.25,,국민안전처,방호조사과
1660000-0054,직장민방위대편성대상업체지정,직장 민방위대 편성 대상업체로 지정을 받고자 하는 사기업체가 신청하는 민원사무입니다.,지정,단순민원,수수료 없음,수수료 없음,10년,2014.11.24,2014.11.25,,국민안전처,민방위과
1660000-0053,직장민방위대(편성·이전·명의변경·해체)신고,직장의 주소이전이나 상호변경 또는 민방위대 인원감소로 직장민방위대의 지정을 해제하고자 하는 민원사무입니다.,신고,단순민원,수수료 없음,수수료 없음,3년,2014.11.24,2014.11.25,,국민안전처,민방위과
1660000-0052,"위험물(제조소, 저장소, 취급소) 용도폐지신고",위험물제조소 등의 허가 받은 시설을 폐지하고자 하는 자가 신고하는 민원사무입니다.,신고,단순민원,수수료 없음,수수료 없음,5년,2014.11.24,2014.11.25,,국민안전처,방호조사과
1660000-0050,위험물탱크안전성능시험자등록,"위험물탱크안전성능시험자로 등록하고자 하는 사람이 기술능력, 시설, 시험장비 등을 갖춘 후 이를 신청하는 민원사무입니다.",등록,단순민원,단일 수수료,수수료 없음,5년,2014.11.24,2014.11.25,,국민안전처,방호조사과
1660000-0049,위험물탱크안전성능시험자 변경신고,위험물 탱크 안전 성능 시험자로 등록 받은 사람이 그 등록 내용의 일부를 변경 신청하는 민원사무입니다.,신고,단순민원,단일 수수료,20000원,5년,2014.11.24,2014.11.25,,국민안전처,방호조사과
1660000-0048,위험물탱크안전성능시험,위험물 제조소 등의 허가를 받은 사람이 위험물 취급탱크를 제작한 후 그 탱크의 안정성능시험을 신청하는 민원사무입니다.,시험,단순민원,요율별 수수료,요율로 정함.,5년,2014.11.24,2014.11.25,,국민안전처,방호조사과
1660000-0047,위험물제조소 등 전부(부분)완공검사,위험물제조소 등 전부 및 부분완공 검사를 신청하는 민원,검사,단순민원,사례별 수수료,"제조소등 설치에따른완공검사(허가수수료의1/2), 제조소등변경에따른완공검사(허가수수료의1/4",5년,2014.11.24,2014.11.25,,국민안전처,방호조사과
1660000-0046,"위험물(제조소, 저장소, 취급소)설치자의 지위승계신고",위험물 제조소 등의 지위를 승계하기 위한 민원,신고,단순민원,단일 수수료,20000원,5년,2014.11.24,2014.11.25,,국민안전처,방호조사과
1660000-0045,위험물제조소 등 설치허가,"지정수량 이상의 위험물을 저장,취급하기 위하여 제조소 등을 설치하고자 하는 사람이 소방서장에게 위험물 허가를 신청하는 민원사무 입니다.",허가,단순민원,사례별 수수료,요율산정,5년,2014.11.24,2014.11.25,,국민안전처,방호조사과
1660000-0044,위험물제조소 등 변경허가,"위험물 제조소 등의 위치,구조,설비 및 품명등을 변경하기 위한 민원",허가,단순민원,사례별 수수료,설치허가 수수료의 1/2,5년,2014.11.24,2014.11.25,,국민안전처,방호조사과
1660000-0043,예방규정제정(변경) 제출,위험물 제조소 등의 허가를 받은 업소 중 사용하기전에 예방 규정을 정하거나 변경하였을 때 제출하는 민원사무입니다.,제출,단순민원,수수료 없음,수수료 없음,5년,2014.11.24,2014.11.25,,국민안전처,방호조사과
1660000-0042,연합민방위대조직신청,"연합민방위대를 조직하는 경우에 통？리 민방위대는 대원수가 가장 많은 통？리의 민방위대장이 읍？ 면동장에게, 직장민방위대는 당해 공업단지？구내 또는 건물을 관리하는 직장의 민？방위대장이 시장？군수？구청장에게 각각 서식의 연합민방위대조직신청서를 제출하는 민원사무입니다.",기타,단순민원,수수료 없음,수수료 없음,3년,2014.11.24,2014.11.25,,국민안전처,민방위과
1660000-0041,민방위대원 응급조치 손실보상금청구,응급조치로 인한 손실을 보상 받고자 할 때 신청하는 민원사무입니다.,기타,단순민원,수수료 없음,수수료 없음,5년,2014.11.24,2014.11.25,,국민안전처,민방위과
